content_id,content_type,content_text,content_url,question_id,title,desc,created_time,updated_time,voteup_count,comment_count,source_keyword,user_id,user_link,user_nickname,user_avatar,user_url_token,last_modify_ts
25137912621,answer,特朗普的当选，创造了一个纪录，那就是他成为了美国历史上权力最大的总统，同时掌握了参议院、众议院和最高法院，成为了三权合一的总统完全体，他必然会被写入美国的历史教科书，供后人去研究他的个人事迹。很多人一直不清楚特朗普为什么能够当选，我在详细研究了他的个人经历之后，终于搞清楚了这个问题。和其他人不同，我不会去扯流水账，动不动就从特朗普的出生讲起，我会直击问题的核心，从特朗普近80年的生平中提炼出三个重大事件，让大家一眼就看出特朗普能当上总统的核心原因。首先第一件事，特朗普是一名货真价实的演员，参演过多部影视作品，比如说《超级名模》《贴身情人》还有在全球十分知名的电影《小鬼当家》，特朗普在里面都有过精彩的表演，和他合作过的导演称赞他是一名很好的演员，有出色的表演才能。这段从影经历让特朗普的表演欲望大爆发，对他的后续人生产生了极大的影响，最好的证明就是，其他美国总统，大多都是端庄、稳重、成熟、有条不紊的，仿佛是一个十分稳定的政治执行机器，但特朗普不同，他的演讲风格幽默俏皮，肢体语言搞笑多变，甚至还经常动不动就带着全场观众一起跳舞，这种表演性的人格不仅能拉近他和选民的距离，还能让他频繁的登上媒体头条，持续的曝光在公众面前，是他能从众多总统候选人中脱颖而出的重要原因。除了当过演员之外，特朗普还办过媒体。比如说在全美十分知名的真人秀《飞黄腾达》就是特朗普投资的，而且他不仅是出钱投资，还亲自上场去当主持人，他知道如何在媒体面前讲话，如何让更多人关注自己，这种主持经历，让特朗普十分享受在公众面前曝光的感觉，他喜欢全美的目光聚焦在他的身上，他享受那种聚光灯下的感觉，从这个角度来看，他天生就适合站在总统竞选这样的大舞台上面去。但苦于以前媒体不够发达，美国人接触信息要么靠电视报纸，要么就是用麻烦的电脑去查证，不利于特朗普的出圈。直到智能手机时代的正式来临，互联网媒体的大爆发，这才让特朗普的声音能够被全体美国人听到，从而一跃成为全球第一网红，这是他当选总统的重要舆论基石。但仅仅靠演员和媒体的经历还是不够了，想要成为总统，还必须要提出自己独到的政治观点，你能给美国人民带来什么，把他们带往一个什么样的未来，这才是你的核心竞争力。一开始特朗普是完全不懂这些的，他甚至没有意识到从政的重要性，一直都是默默地做着自己的房地产生意，虽然也能赚钱，但也面临着极大地风险，在90年代的时候，他还出现过破产的危机，欠下了40多个亿的债务。然后在这个时候，他的一个好哥们，一个摔跤明星竟然成功当上了明尼苏达州的州长，有了政治身份的加成，做起生意赚钱也更加容易了。这件事对特朗普触动极大，从那时候开始他就下定决心，我也要进军政坛，要掌握全美最大的权力，所以他就去参与了总统竞选。但这个阶段的他非常迷茫，不知道提出什么样的核心主张，甚至他对自己的政治立场也是毫无认知，不信我们一起来看一下特朗普搞笑的从政经历，他先是加入了民主党，然后又改投了共和党，随后又在2000年以改革党候选人的身份参与了总统竞选，后面他又多次在民主党、共和党和无党籍之间来回切换，动不动就退党换阵营，直到2016年，他以共和党候选人的身份对上了有37年从政经验，背后有一群政治大佬支持的希拉里。多年的从商经历，让特朗普立马就看清了当时的形势，他知道如果以常规的政治主张去竞选，几乎就是毫无获胜的可能，所以作为一名商人，他一下子就找到了一条独特的赛道，那就是提出美国白人第一，要让美国再次伟大。之所以他看准了这个赛道，是因为他发现当时的美国，在产业转移和移民涌入的浪潮之下，底层白人的生活已经到了难以为继的地步。原因也很简单，那些红脖子，收入低，没文凭，以前只能在工厂干活，现在美国产业外移，工厂纷纷倒闭，他们一下子就失业了，只能从制造业转向服务业，比如说去做餐厅服务员，去当房屋修理工，去帮有钱人修建草坪等等，本来生活还过得下去，但是民主党为了提高自己在摇摆州的胜率，疯狂的引进非法移民，导致大量的黑人和老墨进入美国大地，他们勤劳肯干，工资还要求低，这一下子就挤兑了本土白人的生存空间，让很多红脖子沦落成了流浪汉。更重要的是，外来移民的涌入，带来的还有治安问题，自从非法移民大涌入之后，美国白人每年有上万人被黑人罪犯强奸，抢劫和杀害，那些受害者大多都是美国的底层白人。特朗普正是看懂了这个社会现实，所以才站出来高呼，我要制造业回流，我要白人第一，我要驱逐非法移民，我要让美国再次伟大。看明白没有，特朗普这个人就是这样的，充满了商人的敏锐性和投机性，他一眼就能看出机会在哪里，然后果断出手进行投资，再加上他极具天赋的表演能力，然后叠加上了美国移动互联网时代的大爆发，这才让他同时占据了天时地利人和，从一个政治素人，一跃成为美国总统。通过特朗普的案例我们就能清楚，没有人能够无缘无故的成功，就算是特朗普这种看似疯癫的人，其实也是踩对了多个时代趋势，并做了充足的准备，这才能够人生逆袭，这对我们，有很好的借鉴意义。,https://www.zhihu.com/question/3330773333/answer/25137912621,3330773333,特朗普再次当选为美国总统，他为什么能赢？,特朗普的当选，创造了一个纪录，那就是他成为了美国历史上权力最大的总统，同时掌握了参议院、众议院和最高法院，成为了三权合一的总统完全体，他必然会被写入美国的历史教科书,1730949071,1730949071,104,7,美国总统大选结果,be4996643b04fda8ddc2ec09480a7d55,https://www.zhihu.com/people/chen-ying-nong,枫冷慕诗,https://picx.zhimg.com/50/v2-44eb83371add65028eca8d2be4a77405_l.jpg?source=4e949a73,chen-ying-nong,1733713651911
24253451599,answer,感觉特朗普回当选最新纽约速报：美国大选选情激烈！现已开始开票，特朗普得票暂时635万票(选举人票23)领先，哈里斯得票514万票(选举人票3票)，预估到下午16时左右才能揭晓下任美国总统当选人。简单说一下这两位选举人，分别是共和党的“懂王”特朗普和民主党的“笑王”哈里斯，虽然分属美国链各个党派的额不同阵营，但是：1968年独立候选人乔治.华莱士(George Wallace)曾说过：“民主党和共和党之间没有一毛钱的区别”。“懂王”特朗普他当选了，很可能是一个会改变世界的人，毕竟他说过：“只要他 当选美国总统，就会在2个小时内结束俄乌战争。”然后回继续加大和我们国家的贸易战争，加大关税比例，脱钩更加严重。“笑王”哈里斯她当选了，美国现在的国家政策不会有改变，毕竟她是“睡王”拜登无奈推选之后强推上来的，跟脚接近于无，只能最大可能得延续“睡王”拜登的一揽子政策，继续援助乌克兰，在背后拱火以色列强取豪夺中东地盘。但是感觉“笑王”哈里斯胜率很低，上一次有王者之姿的希拉里就折戟沉沙，拜倒在纯政治素人“懂王”特朗普的“裙下”。霉霉支持哈里斯为了“笑王”哈里斯胜选，美国娱乐圈的影视明星也是操碎了心，如复仇者联盟的“重新集结”但是，作为被枪击之后的“天选之子”特朗普，有更大的动力区赢“懂王”特朗普在宾州反正已经死过一回，之后又被预谋枪击一次，还有不少的法律诉讼等着他，难道不会拼个鱼死网破？只有当上美国总统才是他的人生破局。,https://www.zhihu.com/question/3297722484/answer/24253451599,3297722484,2024年美国大选实时监控，谁能得总统?,https://map.jacksonjude.com/,1730864552,1730864552,10,1,美国总统大选结果,51f59d84314313b610fcd7c4b6c077f6,https://www.zhihu.com/people/liu-si-wen-68,他乡之客,https://picx.zhimg.com/50/v2-abed1a8c04700ba7d72b45195223e0ff_l.jpg?source=4e949a73,liu-si-wen-68,1733713651917
23844471242,answer,本次大选一路透露着极为诡异的气息，可能这就是对全球经济格局产生深远影响的开始……接下来的24小时，是美国总统大选的关键时段，警惕行情出现意外波动。Btc尚未给出顶部形态本文着重围绕哈里斯与特朗普大选后的美国经济与风险投资市场的影响，以及潜在风险。加密这边项目方这几天也都没什么更新热点，都是在等一个结果，等大选出结果了，他们再做预案更新利好。川普赢的话，那肯定一堆利好释放，这是我最喜欢的局面。哈里斯赢的话，那可能短线回调一下，但是长线民主D是大撒币的，各种刺激经济，对于币圈长线算是不错的，只是牛市进程能慢一点。大选不是咱们能左右的，只能根据结果再做出调整。明晚电视台实时计票，市场大概率应该会有巨大波动，来几根针合约就没了，所以合约一定要谨慎。手持现货，空仓的抄底价可以适当挂低一点，说不定一根针波动上就给你成交了，我个人觉得川普赢面能大一些。值得一提的是Polymarket胜率也一直在上涨，但不建议这个竞猜，你看好不如去捡廉价筹码回报比高。因为特朗普的目前的政策基本算是带领着美国工业阶层进行一次工业经济革命，而失去工业已经生产业的问题，一直也被美国的高层所担忧。他们虽然不提，但是并不代表他们不在乎，因为失去了工业竞争力，就等于瘸了一条腿，走不了多远。所以这一次，特朗普背后的支持者会有很多，同时哪怕之前反对他的，可能都会选择保持中立。因为这些人深知，美国需要有人改变现状。这也是我一直看好特朗普可以当选的原因，而且这也是特朗普我认为的最后一次机会，他为了大选基本是承诺了太多，同时也得罪了太多人，如果失败，承诺无法兑现，以及树立的敌人，可能会让特朗普“毫无退路”，所以我认为这一次是特朗普倾尽全力的“一战”。潜在的风险提示：并不是来自经济或者金融市场本身，而是美国两党之间的矛盾。一旦特朗普败选，退无可退的特朗普是否会通过其他途径挑战一下美国的大选？对于加密来说，所有人都希望特朗普上台，因为特朗普明显给市场留下了更好的乐观预期，当然我们要承认，特朗普在此之前确实给予了加密市场更多的认可与信心，但是大家可能不要过度乐观，可能特朗普上任之后，在处理事情的先手顺序上，加密或者说BTC并不会作为首要的目标，当然，言论上的鼓励可能存在，但是真的可以改变什么现状，短期很难。这一点上其实哈里斯与特朗普基本是相似的结果，只不过市场是炒预期的，而特朗普给我们的乐观预期更多，所以大家潜意识中认为特朗普会给加密带来多大的涨幅。这一点就像ETF 通过之后，很多人认为BTC 可以短期涨到十几万几十万一个道理，长期来看，ETF，特朗普都是利好加密BTC 的，但是短期很难有太大的改观。至于添加到国家战略储备，可能更是一个需要等待的流程。当然这里面有个意外因素就是马斯克，一旦马斯克被重用，他可能会给加密带来更好的“情绪价值”。总体来说，特朗普上台，对于风险市场来说，可能没有民主D给的推动力足够，但是特朗普会构建一个相对健康的基本面，可以让金融风险市场更加长久地发展下去，包括BTC，但是反观如果是哈里斯，短期可能会有更多的动力推动风险市场，但是一样也要考虑到潜在的高风险问题。而对于BTC 来说，它可能更需要一个良好稳定的成长环境。最后本轮操作策略要看大选结果，这是其一，第二就是要看双方会不会引发动乱，这是其二，抄底可以，但是分仓。如果文章对你有用的转发，点个关注，私信留言的小发哥看到都会回，大家互相交流互通有无，一起布局在无人问津时，出在人声鼎沸。,https://www.zhihu.com/question/52238589/answer/23844471242,52238589,美国大选当天各州结果公布的时间表，及它们各自的影响？,想找一个大选日当天各州公布结果的时间表，以及它们对于结果的影响。记得退欧公投的时候有一个很详细的时间表，可是美国大选的找了一圈也没有找到能说的非常清楚的。,1730813189,1730813189,8,0,美国总统大选结果,347167acaeb85ad8a4149d6c448fc19c,https://www.zhihu.com/people/zi-jin-pan-de-tao-lu-70,BTC十万刀,https://picx.zhimg.com/50/v2-eb6d1697016f8477d30bc6b503e1a9ba_l.jpg?source=4e949a73,zi-jin-pan-de-tao-lu-70,1733713651919
25479309485,answer,1.降低企业税率，大量创业者会去美国创业，创业不是个人行为，会伴随着大量的资金和专业人才一起协同，2.提高关税，同样的产品，国内买20，美国买因为关税提高了，卖25，产品销售能力，竞争力缩减，产品更难卖3.取消遗产税，财富可传承，吸引大量富人，精英，移民美国。4.美国优先原则，维护美国利益，对全球经济造成伤害。5.降低通涨，总结，美国会对全球优秀企业，资金，人才，富人，精英，产生巨大的虹吸效应，全球经济环境变差，生意难做，就业环境恶劣，经济下滑，局部冲突加剧。与之抗衡的是一带一路，欧亚非关系网，这一次，将会是真正的国运之争，胜负或许就在未来的10年揭晓.,https://www.zhihu.com/question/647420962/answer/25479309485,647420962,2024美国总统大选可能的结果对世界产生的影响预判?,财富可传承，吸引大量富人，精英，移民美国。 4.美国优先原则，维护美国利益，对全球经济造成伤害。 5.降低通涨， 总结，美国会对全球优秀企业，资金，人才，富人，精英,1730971909,1730971909,1,0,美国总统大选结果,4f09ab5d62ab70d9185e1464b95fbeb8,https://www.zhihu.com/people/68393-12,林深见鹿,https://pica.zhimg.com/50/v2-4e73ea892495336a53f4ee7b71f85755_l.jpg?source=4e949a73,68393-12,1733713651922
680655753,article,"拜登失败，无法连任！目前看，特朗普将有80%的概率再次当选美国总统。唯一的变数，就是看民主党这边能否立即选出新的候选人来替换掉拜登，或者通过美国最高法院来取消特朗普的参选资格，否则，民主党将无法阻挡特朗普的获胜。拜登的败选有几大问题：一、对外政治决策不坚决。在俄乌战争、加沙冲突等立场上符合美国利益，但是未能获得更大的政治利益和经济利益。二、对内经济政策缺乏领导力。虽然美国经济依旧前进，但是内部冲突和矛盾也日益增加，凸显总统缺乏全局管控能力。三、年纪太大，已经多次在公共场合出现问题，不能保证四年后依旧可以带领国家前进,这是致命的软肋。仅此一项被特朗普死命攻击，就能将拜登摧毁。四、特朗普这次竞选改变了风格和策略，女儿、女婿好像置身事外不参与其中，不再给对手以把柄，而且，特朗普紧密与各州相呼应，讨好、买好，不再是以往单打独斗的独行侠。只要美国最高法院不阻止，特朗普大概率获胜。",https://www.zhihu.com/p/680655753,,美国2024大选的结果已明确！,目前看，特朗普将有80%的概率再次当选美国总统。 唯一的变数，就是看民主党这边能否立即选出新的候选人来替换掉拜登，或者通过美国最高法院来取消特朗普的参选资格，否则,1706626258,1706626258,3,2,美国总统大选结果,56cbe6a2625ebc325e3682a032607996,https://www.zhihu.com/people/11-76-78-46,京南山,https://picx.zhimg.com/50/v2-abed1a8c04700ba7d72b45195223e0ff_l.jpg?source=4e949a73,11-76-78-46,1733713651924
5275493672,article,美国总统选举最新票选结果据CCTV国际时讯最新消息，截至北京时间今天（11月6日）上午10点，美国已有32个州和华盛顿特区的投票站陆续关闭。根据多家美媒初步测算，特朗普选举人票升至198张，哈里斯获得了99张。美国总统选举采取选举人团制度，50个州按人口比例分配选举人票，获得538张选举人票中的至少270张即为获胜。2024美国总统候选人民主党候选人卡玛拉·哈里斯（Kamala Harris）背景：现任副总统，2023年6月正式宣布参加2024年美国总统大选。哈里斯在2020年当选副总统，是首位女性、非裔和亚裔副总统。主张：医疗保健改革、气候变化、社会正义、教育投资、支持中产阶级等。共和党候选人唐纳德·特朗普（Donald Trump）背景：美国前总统，2022年11月15日正式宣布参加2024年美国总统大选。特朗普在2016年和2020年两次当选总统，但在2020年输给了民主党候选人乔·拜登。主张：经济复苏、法律与秩序、反移民政策、减税、放松监管等。美国总统选举，怎么选？根据美国宪法，美国总统选举实行名为选举人团制的间接选举制度。选举人团由代表50个州和首都华盛顿-哥伦比亚特区的538名选举人组成。要在美国总统选举中获胜，总统候选人必须在总计538张选举人票中拿下至少一半以上、也就是270张才可以当选总统。那么538这个数字是怎么来的呢？各州拥有的选举人票数量，与这个州的国会两院议员人数挂钩。一名参议员或众议员，就意味着一张选举人票。每个州都有2名参议员，众议员人数则根据各州人口比例分配，最少1名。因此选举人票总数，为美国国会参议员人数100、众议员人数435，再加上首都华盛顿-哥伦比亚特区3名专设选举人的数字总和，共计538票。选举人团制度中，最重要的就是“赢者通吃”。除了缅因州与内布拉斯加州以外，其他48个州和华盛顿-哥伦比亚特区都实行“赢者通吃”的制度，也就是说，如果一名候选人获得了多数普选票，他就拥有了这个州的全部选举人票。这也就造成了这样一种现象，即在全国范围内普选票的数量领先并不一定可以赢得选举。2016年特朗普战胜希拉里赢得选举就属于这种情况。2大候选人投票如火如荼当地时间11月5日是美国总统选举的正式投票日，因为时区差异和各州规定不同，各州在当日的投票结束时间不尽相同。最晚结束投票的州是阿拉斯加州，在美国东部时间6日凌晨1时结束（北京时间11月6日14时）。夏威夷州是倒数第二个结束投票的州，在美国东部时间6日0时结束投票（北京时间11月6日13时）。截至发稿，美国共和党总统候选人、前总统特朗普赢得了肯塔基州、印第安纳州、西弗吉尼亚州、亚拉巴马州、密西西比州、南卡罗来纳州、俄克拉何马州、佛罗里达州、田纳西州、阿肯色州。美国民主党总统候选人、副总统哈里斯赢得了佛蒙特州、马萨诸塞州、康涅狄格州、马里兰州、罗得岛州、华盛顿特区、新泽西州、特拉华州、伊利诺伊州。据央视新闻援引美国有线电视新闻网（CNN）报道，美国佐治亚州州务卿布拉德·拉芬斯佩格表示，该州共有12个投票站因炸弹威胁而延长投票时间，另有3个投票站因“正常原因”而延长投票时间。美国总统选举采取选举人团制度，50个州按人口比例分配选举人票，获得538张选举人票中的至少270张即为获胜。密歇根州 少数族裔选民成大选结果关键美国中北部的密歇根州被认为是今年左右美国大选的7个关键摇摆州之一。在11月5日之前，该州的提前投票及缺席投票显示，哈里斯与特朗普的得票率相当，选情胶着。美国媒体分析指出，少数族裔选民成为密歇根州大选结果的关键，该州有全美各州最高比例、超过20万的阿拉伯裔选民，许多人对美国政府持续援助以色列，对巴勒斯坦、黎巴嫩采取军事行动表示愤怒，表示不会投票给哈里斯或特朗普中的任何一人，这也让密歇根州的大选结果更加难以预测。美国密歇根州选民 拉里：因为作为美国人，我们应该对巴勒斯坦人、黎巴嫩人、也门人以及叙利亚、伊拉克人等负有责任，因为以色列得到的来自美国的支持比任何一个国家都多。我们应该采取行动，阻止美国政府继续支持以色列的这种种族灭绝行为。选民还表示，民主共和两党的大选宣传就是作秀，无论哈里斯和特朗普谁会胜出，都不会对美国政府的中东政策进行实质性改变。这种失望情绪也让许多选民放弃投票。美国密歇根州选民 拉里：民主共和两党都进行了大规模宣传，好像这次大选多么重要，每个选民的声音都会听见，但实际上根本不会。当大部分民众希望停火早日达成美国政府停止援助以色列时，如果中东停火不能达成，那所谓的民主就是一个骗局。央视记者 刘旭：阿拉伯裔选民表示，对于美国政府几十年来持续插手别国事务、挑起地区争端，甚至冲突、战火等情况表示厌恶和失望。他们也不认为任何一位候选人上台之后，会给美国政府的政策带来积极性的改变。,https://www.zhihu.com/p/5275493672,,美国总统大选开票最新结果：198：99，总统之位即将尘埃落定--洁柯生命,Harris） 背景：现任副总统，2023年6月正式宣布参加2024年美国总统大选。哈里斯在2020年当选副总统，是首位女性、非裔和亚裔副总统。 主张：医疗保健改革、气候变化、社会正义、教育投资、支持中产阶级等,1730862101,1730863771,17,3,美国总统大选结果,2ef0f0a86a67d0ff0dab267f8ebb7aa6,https://www.zhihu.com/people/83-8-51-4,洁柯生命健康,https://picx.zhimg.com/50/v2-bf3e7e194b3710e6dd9f3c24690497a2_l.jpg?source=4e949a73,83-8-51-4,1733713676320
