content_id,content_type,content_text,content_url,question_id,title,desc,created_time,updated_time,voteup_count,comment_count,source_keyword,user_id,user_link,user_nickname,user_avatar,user_url_token,last_modify_ts
15542608,answer,有些州计票结果还没出，但是是某党的优势州，所以选举人票先计入结果了，比如加州的计票结果还没出，但有些媒体已经把票算到奥巴马头上了新浪这篇解答很详细，媒体如何决定美国大选胜者？http://http://news.sina.com.cn/w/sd/2012-11-06/150525520817.shtml,https://www.zhihu.com/question/20580643/answer/15542608,20580643,各媒体的美国大选计票结果是如何得出的？为什么差异巨大？,BBC 看上去计票最快，奥巴马领先：http://www.bbc.co.uk/news/world-us-canada-15949569 NYT 上，罗姆尼还领先：http://elections.nytimes.com/2012/results/president/big-board截图时间：北京时间 2012 年 11 月 7 日 11：53感谢 VV 补充，目前为止最快的：http://election2012.npr.org/bigboard/president.html,1352261160,1352261637,2,1,美国总统大选结果,2016caca4440b635b29dc33ef2a45ac2,https://www.zhihu.com/people/sun-cun-long,孙存龙,https://pic1.zhimg.com/50/90f545bbe_l.jpg?source=4e949a73,sun-cun-long,1733713610296
4546426947,answer,11.5 更新已投票， 州县市 和总统，全投的共和党人。—————-刚收到选票， 想投特朗普的请点赞，想投哈里斯的请点收藏。 截止日期10.30日。 届时我会根据本回答点赞情况进行投票。———————————————————————————10.11 更新， 从本文发布起到现在，赞和收藏的比例稳定的在10:1左右， 目前是8000+赞，800+搜藏。 虽然不是很情愿，但今年应该大概率投特朗普了。关于中文选票：第一，冷知识，美国在联邦层面并没有规定官方语言。第二，美国是一个多元文化多元种族的国家， 其中有大量英语不好的一代移民。 多语言发布信息对于这边政府是常态， 汉语作为世界上主要语言之一，当然在这边有一席之地。 注册选民的时候可以选择自己需要的语言。第三，加州投票无用论， 一个人的投票，在现实层面是几乎不会有影响到结果。 但普选的价值并不在于此，普选最重要的意义在于权力合法性的来源。 是宗教式的君权天授，还是教条式的高举某旗帜，还是说来自于普通公民。 权力只会对权力的来源负责，选民手中的票是悬在政客们头上的达摩克利斯之剑，时刻提醒他们，不要做得太过分。,https://www.zhihu.com/question/667347225/answer/4546426947,667347225,大家来预测一下，这次美国大选，哈里斯和特朗普谁能赢？,其实想知道两人的支持率有个简单的办法，就是查查义乌生产的两人的周边产品订单数量，一对比就清楚了。。但那没啥用啊，重要的是摇摆州的数据。谁能提供摇摆州两人支持率的可靠数据？当然，我赌一块钱特朗普赢。。嘿嘿。。旧王归来！我赌赢了！哈哈哈哈！特朗普赢得了大选，接下来，我想看哈里斯政变登基！第二次南北战争！,1728438207,1730862658,8575,738,美国总统大选结果,b157af011e8ab2ff2872f25aa79501de,https://www.zhihu.com/people/wang-han-yin-57-78,Yuan,https://picx.zhimg.com/50/v2-6f86d2cdf0c21a6bb2c997d62877b463_l.jpg?source=4e949a73,wang-han-yin-57-78,1733713610298
130494423,answer,"google.com.hk 的页面公开的页面挂了，看来还是qq群好2016美国大选实时票数统计其他不确定可以打开的网址：ElectoralVotehttp://http://edition.cnn.com/election/resultsCNN - Breaking News, U.S., World, Weather, Entertainment &amp; Video NewsNOW: 希拉里0票v.s特朗普0票2016 Presidential Election HeadquartersCBSN - Live Streaming Video News Channel",https://www.zhihu.com/question/40599437/answer/130494423,40599437,哪个英文网站可看到2016美国大选初选的实时投票结果？,google.com.hk 的页面 公开的页面挂了，看来还是qq群好 2016美国大选实时票数统计 其他不确定可以打开的网址：ElectoralVotehttp://edition,1478654653,1478670185,52,9,美国总统大选结果,4b60bb0ac1967dae8e9d7c644ccdcfb8,https://www.zhihu.com/people/jarnar,江南,https://pic1.zhimg.com/50/v2-27c1330183e1b086e3708c89907189e6_l.jpg?source=4e949a73,jarnar,1733713610301
9626931692,article,1美国大选已经过去三个星期了，全部选票还没有统计完毕，还有0.8%的选票，大概还有120万张没有统计，效率有点感人。这部分选票主要在民主党优势州。差不到1%，误差可以接受，就补一个数据分析吧。图片来源:网络从总票数看，特朗普预计最终可以获得7700万以上张选票，哈里斯可以获得7500万张左右。和2020年大选相比，特朗普多获得了300万张选票，哈里斯比拜登当时（8128万张）少获得了600万张。有一种说法，认为2020年大选，民主党作弊，搞了千万假选票。还有一张图，说民主党赢了所有不要求选民ID的州，输掉了要求选民ID的州。图片来源:网络2012年，奥巴马拿到了6591万张选票，2016年，希拉里只拿到了6585万张选票，2020年，拜登拿到了8128万张，一下子多了1500万张票，2024年，哈里斯只拿到了7500万张。这个说法表面上很有迷惑性，确实，2020年拜登的得票数量是美国历史上最高的，但实际则不然。特朗普的崛起，让美国大选的投票率有非常显著的上升，从2012年的59%，上升到2016年的60%，到2020年的67%。2020年选票异常上升的，不仅仅是民主党。2012年，罗姆尼拿到6093万张，2016年特朗普拿到6298万张，2020年，特朗普拿到7422万张。特朗普同样多了1100多万张选票。2024年，哈里斯少拿了600万张票，丢在哪里？2我们看一下分州的数据：哈里斯少的600万票中，有200万票来自加州。加州，纽约、佛罗里达、得克萨斯、伊利诺伊、新泽西和马萨诸塞这七个州少了500万张选票。这七个州都是人口大州，同时也都不是摇摆州。按比例计算，除了得克萨斯之外（8.6%），其他六个州，哈里斯都丢了超过10%的票数。图片来源:网络这七个州里面有需要投票人身份证的佛罗里达和得克萨斯，也有不需要投票人身份证的蓝州。2020年大选如果拜登有阴兵，往这七个州灌选票也没有任何意义，这七个州都是比较稳定的民主党州或者共和党州，灌阴兵选票，也是灌摇摆州的。然后我们再看看摇摆州。图片来源:网络本次大选7个摇摆州，除了亚利桑那外，剩下六个摇摆州中，和拜登相比，哈里斯都没有丢太多的票，比例都低于3%。甚至内华达、北卡、威斯康星、佐治亚这四个州，哈里斯的得票数量比2020年的拜登还多。（2024年大选，哈里斯在五个州的得票数量超过2020年的拜登，其中四个是摇摆州）7个摇摆州中哈里斯总得票是1535万张，2020年的拜登是1543万张，哈里斯只少了7万多张票，远高于奥巴马的两次选举和2016年的希拉里，其实表现也可以了。摇摆州的数据说明，民主党2020年阴兵灌票的几率不大，七个摇摆州2024年的哈里斯和2020年的拜登相比，得票总数差别不大。但特朗普在7个摇摆州表现远超预期，在2020年，7个摇摆州只获得了1519万张选票，2024年获得了1612万张选票，多了接近100万张。这个结果，让哈里斯丢掉了所有7个摇摆州。一般人理解，摇摆州，肯定中间派比较多，哈里斯丢票，应该丢在摇摆州。事实正好相反，哈里斯丢掉了600万张票，都是在胜负早已确定的非摇摆州，摇摆州反而只丢了7万票。全国范围内的投票率，2024年和2020年相比，有明显下降。从66-67%跌到65%左右。但七个摇摆州中的五个，投票率反而上升。无论是特朗普还是哈里斯，都在用一切手段让摇摆州支持自己的选民出来投票。图片来源:网络特朗普2016年当选后，我写了一篇文章《民主的黄昏》。其中一个观点是，随着美国政治的极化，大选取胜，已经不是靠争取摇摆的中间派了，而是靠最大限度的动员基本盘，让基本盘出来投票。谁能动员更多的基本盘出来投票，谁就是最大的胜者。2020年大选，无论是特朗普还是拜登，和2016年相比获得的票数都增加了1000多万张，两党都把动员基本盘，特别是摇摆州的基本盘选民，做为最重要的事情。2024年也不例外。正因为此，民调预测也就变得更加困难。选举的结果不再取决于选民的倾向，而更多取决于对基本盘的动员能力。从2016到2024年，民调一直低估了特朗普一方的动员能力。就算民调预估准了选民倾向，但动员能力很难通过民调判断清楚。图片来源:网络大选前，在宾州这样的关键摇摆州，两党都全力动员出门投票，挨家挨户的敲门，每天抽奖100万美元，这些方式能让一个哈里斯的粉丝投特朗普吗？肯定不行。这些动员方式都是增加基本盘投票率的。共和党在摇摆州投票率的优势，是特朗普此次胜出的重要原因。图片来源:网络从大选数据看，无论是民主党还是共和党，增加投票人数的催投票策略都还是有效的。催投票策略，更多的集中在摇摆州。2024年哈里斯和拜登相比少了600万票，但占总得票20%（1535万票的）七个摇摆州只少了7.4万票。剩余少的590多万票，都在非摇摆州。特朗普也一样，特朗普比2020年多了300万票，而占总票数20%的七个摇摆州，多了90多万票，占特朗普增加票数的30%。从这一点看，哈里斯在摇摆州的表现相对其他地区，其实并不差。4其他一些大选的有趣数据：自从上个世纪六十年代的民权运动以来，民主党一直得到美国穷人的支持，在比较穷的三分之一人口中的支持率一直远高于共和党。这个趋势在最近10年迅速逆转。2024年民主党第一次在富有的三分之一选民中的支持率超过了共和党。而共和党也第一次在贫穷的三分之一选民中的支持率超过了民主党。图片来源:网络图片来源:网络下面这张图说明了民主党是怎么从克林顿时代的，以低教育低收入为基本盘的党派，转化成哈里斯时代高收入高教育水平的党派。而共和党正好相反，基本盘逐步变成了低教育低收入水平的人群。图片来源:网络然而，特朗普和共和党的政策是很偏向富人阶层的。一个亿万富翁候选人，政策偏向富人，但靠着自己的忽悠和天赋，却得到了更多美国穷人的支持，这也是一个奇迹吧。民主党背叛了工人阶级，美国的工人阶级别无选择，只能支持特朗普了。认为民主党代表工人阶级的比例从1960-80年的30%，下降到2020年的10%出头，2024年应该更低。图片来源:网络美国人在议员和总统的投票变得非常一致。上个世纪，议员投票投A党，总统投票投B党很常见。今天则完全不同。民众对党派更加忠诚。支持共和党的，投特朗普也会投共和党的议员，支持民主党也同样。,https://www.zhihu.com/p/9626931692,,数据回顾一下本次美国大选,都在用一切手段让摇摆州支持自己的选民出来投票。 图片来源:网络 特朗普2016年当选后，我写了一篇文章《民主的黄昏》。其中一个观点是，随着美国政治的极化，大选取胜，已经不是靠争取摇摆的中间派了，而是靠最大限度的动员基本盘,1732792151,1732792151,27,3,美国总统大选结果,efa9541155a08a6ec58dea00440d9b9e,https://www.zhihu.com/people/jonwe-86,Jones,https://pica.zhimg.com/50/v2-3d792070b5d8d57a69e484d20ecf22d9_l.jpg?source=4e949a73,jonwe-86,1733713610305
24678083949,answer,特朗普宣布胜选，有可能三权归一       11月6日下午，根据《国会山报》、美国福克斯新闻等多家美国媒体最新公布的测算，特朗普将收获超过270张选举人票，预计将成为美国新总统。特朗普也已经宣布胜选。        本文会来对今天美国大选进展过程，来做一个梳理分析。       美国大选正式投票日是11月5日。11月6日早上8点，各投票站会逐步关闭，然后主流媒体大都有实时计票的功能。早上10点的时候，美联储的实时统计是哈里斯获得99票，特朗普获得120票。共和党是红色作为标志色，民主党是蓝色作为标志色。美联社的这张图，深红色和深蓝色，才是已经确定的开票结果。深红色就是特朗普获得该州所有选举人票，深蓝色就是哈里斯获得该州所有选举人票。浅红色和浅蓝色意思是还在计票过程里，只是目前计票的结果，有可能翻蓝，也有可能翻红。比如得州是城市先开票，所以得州一开始是浅蓝，然后随着农村开票得州已经变成浅红。       美国总统并非直选，美国大选民众投票只能决定各州的胜者是谁。 一个州谁得票率更多，这个州的“选举人团”就会集体投票给该州胜者，有所谓赢者通吃制度，然后两党候选人谁获得的选举人票数越多，就能成为美国总统。 然后不同州的选举人票数是不一样，跟该州人口规模挂钩，一个州选举人票最少也有3张，最多的是加州有54张。两个候选人，获得538张选举人票中的至少270张即为获胜。佛罗里达州是浅红州，这次特朗普以56%得票率的较大优势，率先出结果，给特朗普贡献了30张选举人票。单单得州和佛州，这两个州就给特朗普贡献了70张选举人票。最关键还是看七大摇摆州的情况。 七大摇摆州就是亚利桑那州、佐治亚州、密歇根州、内华达州、北卡罗来纳州、宾夕法尼亚州和威斯康星州，到了11点，最关键的摇摆州宾夕法尼亚州也由蓝翻红。开票率是49%，特朗普得票率是50.5%，哈里斯得票率是48.6%；       这次美国大选，一直有得宾州者得美国的说法，因为七大摇摆州里，宾州的选举人票是最多的，有19张选举人票。到了中午12点，形势已经比较明朗了，特朗普是全面占据优势。 虽然弗吉尼亚州不出意外的翻蓝了，但七大摇摆州特朗普全面占优。除了内达华州还没有计票，特朗普在其他6个摇摆州领先。      受此影响，押注网站上，特朗普胜率也是出现一波飙升。一口气从60%的胜率，上涨到中午12点为93%的胜率。       到下午2点的时候，特朗普基本是稳赢了。确定出的结果，特朗普有247票了。      还没有出结果的摇摆州，威斯康辛州开票率84%，特朗普得票率51%，领先哈里斯47.4%；      最关键的宾州，开票率92%，特朗普得票率51.1%，哈里斯得票率47.8%，就算哈里斯搞阴兵选票，也无力回天了。     到了6日下午2点半，据多家美国媒体最新初步测算结果，特朗普将赢得宾夕法尼亚州。     于是多家美国媒体，就直接测算宣布，特朗普将收获超过270张选举人票，预计将成为美国新总统。        虽然美国大选结果出来了，但可以吃的瓜还有很多。 民主党会不会服输，这是一个很大问题。而且美国极左翼势力可都不是什么善茬，在特朗普当选后，这些极左翼势力有很大可能会在全美范围内制造大规模骚乱。包括美国两党政权交接，会不会出现什么混乱。 明年特朗普上任后，三权合一的特朗普会如何对民主党大规模清算。这些都是吃瓜点。另外，当前只是主流媒体根据最新得票率计算出来的结果，还不是正式公布结果。美国通常还要走一系列形式化的流程程序。2024年11月6日至12月11日：各州认证选举结果。2024年12月17日：选举人团开会投出正式选票。这一步属于形式化。虽然存在所谓失信选举人，但现在失信选举人如果投给该州败者，会被该州裁定为投票无效。所以，这是一个完全形式化的流程。2025年1月6日：美国国会召开会议以统计并认证选举人票数。这里有一个有意思的地方，美国是由副总统来在1月6日计票，现在也就是哈里斯。有一种说法认为，如果特朗普获胜，哈里斯会计票搞鬼。但这个当段子看就行了。因为选举结果已经确定了，哈里斯计票也只是走一个形式流程，她是没有能力去更改美国大选结果。因为这个计票，是以各州的选举结果确定的，又不是非公开有暗箱操作空间，哈里斯的计票是纯粹走流程而已。然后，2025年1月20日，特朗普将正式宣誓上任。需要注意的是，共和党还已经拿下了参议现在众议院结果还没有最终确定，但目前众议院也是共和党占优。假如共和党拿下参众两院。再加上美国最高法院大法官目前还是保守派占优。这等于特朗普是三权合一了，没有人能制衡他了，这对我们并不是什么好事。特朗普当选倒是没什么，关键是三权合一的特朗普会很让人头疼。美国不管谁当总统，最好都是跛脚总统，这才会对我们比较有利。特朗普这样一个行为乖张偏激的人，如果没有国会束缚他，那他会做出什么事情，是很难想象的。但我们也没啥好怕的，兵来将挡水来土掩就是了。而且这对美国来说会更糟糕，这不是美国下坡路上踩油门，而是在下坡路上开氮气加速了。只能说，这次民主党表现极其拉胯，最近几天网络舆论还一直渲染哈里斯稳赢的气氛。有好多人最近几天跑来问我，是不是哈里斯要赢了。我是一直说，这类哈里斯稳赢的说法并不靠谱。结果民主党这次惨败而归，也说明民主党这4年执政有多么不得人心，美国现在的高通胀问题一直是美国选民最关心的。但问题是，特朗普上来，能解决高通胀吗？反倒是特朗普全面加关税的行为，会加剧美国通胀。这不得不说，还是挺讽刺的美国两党现在不管谁上来，都没办法解决美国面临的危机。现在特朗普已经当选，我们看完热闹，也需要冷静一下。我们吃瓜看戏就好，不要过于代入了。要记住，特朗普是一个在过去八年时间里，不断对我们进行各种造谣污蔑，并且进行各种无底线攻击的人，贸易战，科技战，生物战，都是特朗普任内搞出来的。这样一个人三权合一，我们该有的警惕，还是应该要有。还是有底线思维，做好全面斗争的准备，惊涛骇浪还在后面。,https://www.zhihu.com/question/1948552386/answer/24678083949,1948552386,本次美国大选，美国总统，参议院，众议院会不是都是共和党的?,特朗普将收获超过270张选举人票，预计将成为美国新总统。特朗普也已经宣布胜选。 本文会来对今天美国大选进展过程，来做一个梳理分析。 美国大选正式投票日是11月5日。11月6日早上8点,1730893724,1730893829,6,2,美国总统大选结果,4be29ba3bcbe7485255145d76f4f9f91,https://www.zhihu.com/people/1-32-83-86,腾达,https://pica.zhimg.com/50/v2-f1baa6e313d96e0c7268c580e7360fb1_l.jpg?source=4e949a73,1-32-83-86,1733713610309
