content_id,content_type,content_text,content_url,question_id,title,desc,created_time,updated_time,voteup_count,comment_count,source_keyword,user_id,user_link,user_nickname,user_avatar,user_url_token,last_modify_ts
130548679,answer,"自大选以来，我一路嘲讽美国民主，直至今日。大选结果出来，不得不说，民主的纠错能力又一次得到体现。人民用实际行动打破了希拉里的腐败统治，打破了主流媒体的洗脑，打破了精英阶级的垄断。纽约时报，实力打自己脸。大家可能都听过美国的政治图谱：东纽约，西加州，中间一个华盛顿特区，全部都是民主党的铁杆死忠。再加上麻州，伊利诺伊，西雅图，宾夕法尼亚……基本上外国人能够想到的大城市，都是民主党票仓。对应到中国是什么概念呢？相当于北上广三大bug全都统一战线，你说剩下的屁民还怎么玩儿？然而，大城市就能够代表全国人民吗？这张图是2012年，由密西根大学教授Mark Newman做的，出处在此：Election maps. 意思就是说，如果投票不按照State（州）划分，而根据更小的County（县/郡），那么共和党（红色）的覆盖率远远超出人们的想象。但是共和党最终仍旧落败，说到底，大城市的人口决定了票数的走向。民主党这些年来，讨好Top1%的华尔街精英，讨好非法移民少数族裔，唯独忘记了中坚的广大人民。这批人本来也未必是Trump的支持者，然而民主党吃相太差，什么奥巴马医保、同厕案，逼得良家人民跳反。这是自做死，不可活。我党伟大领袖毛主席早就说过了：许多农民运动的道理，和在汉口、长沙从绅士阶级那里听得的道理，完全相反。许多奇事，则见所未见，闻所未闻。我想这些情形，很多地方都有。所有各种反对农民运动的议论，都必须迅速矫正。革命当局对农民运动的各种错误处置，必须迅速变更。这样，才于革命前途有所补益。因为目前农民运动的兴起是一个极大的问题。很短的时间内，将有几万万农民从中国中部、南部和北部各省起来，其势如暴风骤雨，迅猛异常，无论什么大的力量都将压抑不住。他们将冲决一切束缚他们的罗网，朝着解放的路上迅跑。一切帝国主义、军阀、贪官污吏、土豪劣绅，都将被他们葬入坟墓。一切革命的党派、革命的同志，都将在他们面前受他们的检验而决定弃取。以上这番话，出自于《毛泽东：湖南农民运动考察报告》。这份旷世巨著里还有一段家喻户晓的名言：革命不是请客吃饭，不是做文章，不是绘画绣花，不能那样雅致，那样从容不迫，文质彬彬，那样温良恭俭让。可怜希拉里，买通华尔街，买通FBI，最终仍旧落得个身败名裂的下场。下一站HillaryForPrison，几乎已成定局。我不会说这是狂人川普的胜利，这也未见得是共和党的胜利，这是沉默的大多数又一次决定了历史的走向。媒体成天宣布希拉里领先10几个百分点，但是你当人民都是瞎子吗？两人的集会就是这样的画风，你说你拧巴着整出个民调数字还有什么意义？我甚至会想，媒体整天宣布希拉里大胜特胜，会不会让很多潜在支持者反而懒得去投票了呢？最后说一点，这次大选最最恶心到我的地方，正是主流媒体纷纷把希拉里阵营标榜为精英，把川普支持者打压成没有学历的文盲。自封为受过高等教育，就能够占据了真理吗？我就呵呵了，整天只会喊口号、连人民群众的基本需求都想不明白的人，也有脸自称精英？你们的教育都被狗吃了吧。我仿佛看到了毛主席他老人家，一边摸着希拉里的头，一边笑眯眯地说：Too young, too simple, sometimes naive.——————PS：这次Trump出人意料地拿下关键性的宾州，并且只赢了区区1%，你们想到了什么？反正我第一时间就想到了华人挺川：历史的大潮，往往就是由小民的微末努力而改变的。岂能因声音微小而不呐喊？----更多留学、时事相关，欢迎来微信同名公众号 丙等星（bingdengxing）找我玩。",https://www.zhihu.com/question/52392693/answer/130548679,52392693,如何评价 2016 年 11 月 8 日美国总统大选结果？,相关问题：2016 美国大选投票已正式开始，特朗普和希拉里的形势如何？新华社快讯：美国东部时间8日零时（北京时间8日13时）刚过，美国新罕布什尔州迪克斯维尔山口的选民率先投票，这标志着四年一度的美国总统选举投票正式开始。北京时间11月9日中午，2016年美国总统大选结果出炉，美国共和党总统候选人唐纳德·特朗普（Donald John Trump）在投票中一举击败民主党总统候选人希拉里·克林顿（Hillary Diane Rodham Clinton），成功赢得美国大选，登顶美国新一届总统宝座。,1478675173,1478716259,1610,93,美国总统大选结果,c4026922a5777190ca7225a7593ac598,https://www.zhihu.com/people/bing-deng-xing,丙等星,https://picx.zhimg.com/50/4bae51415723cfd35dd5e16fa5ebdafc_l.jpg?source=4e949a73,bing-deng-xing,1733713592410
